title,genres,overview
The Matrix (1999),Action|Sci-Fi,"A computer hacker discovers the nature of reality and fights agents in a simulated world."
Inception (2010),Action|Adventure|Sci-Fi,"A thief who enters dreams is given a task to implant an idea."
Interstellar (2014),Adventure|Drama|Sci-Fi,"A team travels through a wormhole searching for a new home for humanity."
The Dark Knight (2008),Action|Crime|Drama,"Batman faces the Joker, who threatens Gotham City."
Pulp Fiction (1994),Crime|Drama,"The lives of multiple criminals intertwine in tales of violence and redemption."
